Internship_ID,Title,Company,Location,Education_Level,Skills_Required,Sector,Duration_Months,Stipend_Range,Mode,Application_Deadline,Industry,Job_Description,Benefits,Number_of_Openings
1,Internship 1,Company 1,Chennai,MBA,"Communication, Marketing",Education,1,11228-49094,Online,2025-11-01,Education,"This internship requires skills in Excel, ML, AI, Deep Learning and relevant experience.",Certificate,5
2,Internship 2,Company 2,Kolkata,PhD,"SEO, Communication, Finance, Python",Operations,3,15666-42823,Hybrid,2025-03-05,Healthcare,"This internship requires skills in Project Management, Excel and relevant experience.",Letter of Recommendation,4
3,Internship 3,Company 3,Chennai,B.Com,"Java, HTML",Design,1,17941-45421,Hybrid,2025-01-15,Tech,"This internship requires skills in Communication, HTML, AI and relevant experience.",Networking,3
4,Internship 4,Company 4,Bangalore,M.Com,"Project Management, Python, Java, Finance",Marketing,2,16993-35042,Offline,2025-12-18,Education,"This internship requires skills in Data Analysis, Python, Marketing, Communication, UI/UX and relevant experience.",Stipend,8
5,Internship 5,Company 5,Chennai,B.Tech,"SEO, SQL, C++, AI",Finance,6,9903-30944,Hybrid,2025-10-22,Healthcare,"This internship requires skills in JavaScript, Communication and relevant experience.",Networking,8
6,Internship 6,Company 6,Kolkata,M.Tech,"Java, CSS, JavaScript, Data Analysis",Education,5,13997-20979,Hybrid,2025-08-12,AI,"This internship requires skills in C++, Accounting, Python, Project Management and relevant experience.",Networking,1
7,Internship 7,Company 7,Pune,PhD,"Project Management, Excel, SEO, Data Analysis",Technology,2,17686-41704,Online,2025-11-11,Education,"This internship requires skills in SEO, Communication, Java and relevant experience.",Flexible Hours,3
8,Internship 8,Company 8,Chennai,PhD,"Finance, Project Management, HTML",AI,4,8696-46922,Hybrid,2025-05-24,Healthcare,"This internship requires skills in Excel, Data Analysis, SEO and relevant experience.",Flexible Hours,7
9,Internship 9,Company 9,Kolkata,MBA,"JavaScript, Accounting, CSS",Finance,2,13773-20766,Online,2025-08-03,Healthcare,"This internship requires skills in Data Analysis, Accounting and relevant experience.",Letter of Recommendation,5
10,Internship 10,Company 10,Mumbai,BBA,"Excel, Java, JavaScript",Education,6,13158-22178,Hybrid,2025-08-10,Finance,"This internship requires skills in Project Management, NLP, AI, SQL and relevant experience.",Networking,5
11,Internship 11,Company 11,Delhi,PhD,"Accounting, Data Analysis",Research,1,10180-21947,Online,2025-06-08,Marketing,"This internship requires skills in CSS, Finance, ML, Deep Learning, SEO and relevant experience.",Letter of Recommendation,1
12,Internship 12,Company 12,Delhi,MBA,"SQL, UI/UX",Education,5,13901-49554,Online,2025-01-28,Education,"This internship requires skills in Accounting, Python and relevant experience.",Networking,4
13,Internship 13,Company 13,Pune,MBA,"C++, Accounting, Marketing",Healthcare,3,8154-22863,Online,2025-06-13,Tech,"This internship requires skills in UI/UX, CSS and relevant experience.",Letter of Recommendation,10
14,Internship 14,Company 14,Mumbai,B.Com,"UI/UX, Python, NLP, Marketing, JavaScript",Education,2,10761-37789,Hybrid,2025-09-04,Tech,"This internship requires skills in CSS, Deep Learning, Excel, Communication and relevant experience.",Letter of Recommendation,1
15,Internship 15,Company 15,Hyderabad,B.Com,"HTML, Communication",Finance,1,12266-36180,Online,2025-03-01,Healthcare,"This internship requires skills in JavaScript, Communication, Java, NLP and relevant experience.",Flexible Hours,8
16,Internship 16,Company 16,Delhi,M.Tech,"Deep Learning, Data Analysis, AI",Operations,5,8406-40397,Online,2025-02-04,Marketing,"This internship requires skills in Deep Learning, Communication, C++, Java and relevant experience.",Networking,2
17,Internship 17,Company 17,Pune,M.Tech,"Accounting, Python, Communication, UI/UX",AI,2,11378-37860,Offline,2025-08-07,Healthcare,"This internship requires skills in Deep Learning, C++, Finance, ML, Marketing and relevant experience.",Letter of Recommendation,4
18,Internship 18,Company 18,Bangalore,M.Com,"UI/UX, Communication, NLP, Excel, ML",Healthcare,5,11801-28013,Online,2025-06-13,AI,"This internship requires skills in NLP, Finance, SEO, ML and relevant experience.",Certificate,4
19,Internship 19,Company 19,Mumbai,PhD,"SEO, Python, JavaScript, ML, Java",AI,4,10596-26376,Online,2025-02-01,Tech,"This internship requires skills in Java, JavaScript, CSS, ML, Python and relevant experience.",Networking,2
20,Internship 20,Company 20,Chennai,M.Com,"ML, Project Management, UI/UX, Java",Marketing,2,12372-23929,Hybrid,2025-07-15,Healthcare,"This internship requires skills in Marketing, SQL, Data Analysis and relevant experience.",Letter of Recommendation,9
21,Internship 21,Company 21,Chennai,BBA,"Accounting, ML",Design,5,8593-24513,Offline,2025-09-02,Finance,"This internship requires skills in JavaScript, NLP, C++, Project Management and relevant experience.",Stipend,1
22,Internship 22,Company 22,Chennai,M.Tech,"AI, C++, SEO, Python, NLP",Education,1,7955-44927,Hybrid,2025-01-01,Tech,"This internship requires skills in JavaScript, Marketing and relevant experience.",Letter of Recommendation,8
23,Internship 23,Company 23,Chennai,M.Tech,"UI/UX, HTML, Marketing, Deep Learning",Finance,5,9620-49349,Offline,2025-12-28,AI,"This internship requires skills in JavaScript, CSS, C++ and relevant experience.",Stipend,8
24,Internship 24,Company 24,Mumbai,M.Com,"HTML, Python",AI,5,11812-42849,Offline,2025-02-19,AI,"This internship requires skills in ML, Accounting, C++, Excel and relevant experience.",Flexible Hours,1
25,Internship 25,Company 25,Hyderabad,M.Tech,"Excel, Finance, Data Analysis, Deep Learning",Operations,1,16677-40227,Online,2025-05-14,AI,"This internship requires skills in Communication, ML, SEO, Accounting and relevant experience.",Letter of Recommendation,1
26,Internship 26,Company 26,Bangalore,MBA,"JavaScript, Data Analysis, C++",Design,4,7667-46133,Online,2025-05-14,Education,"This internship requires skills in CSS, C++, Excel and relevant experience.",Stipend,7
27,Internship 27,Company 27,Delhi,MBA,"Excel, Data Analysis, AI, Accounting, SQL",Design,3,10845-34908,Offline,2025-09-14,Tech,"This internship requires skills in SQL, ML, NLP, Communication, SEO and relevant experience.",Certificate,4
28,Internship 28,Company 28,Hyderabad,B.Com,"Python, SQL, Deep Learning",AI,3,11008-47691,Online,2025-06-13,Education,"This internship requires skills in Java, C++, Excel, Python and relevant experience.",Flexible Hours,2
29,Internship 29,Company 29,Pune,B.Tech,"CSS, Communication, AI, C++",AI,1,13111-34880,Online,2025-01-22,Healthcare,"This internship requires skills in SQL, Deep Learning, HTML and relevant experience.",Letter of Recommendation,1
30,Internship 30,Company 30,Bangalore,BBA,"Deep Learning, SEO, Data Analysis, Finance, AI",Technology,2,14594-46190,Offline,2025-03-07,Education,"This internship requires skills in Communication, HTML, ML and relevant experience.",Flexible Hours,2
31,Internship 31,Company 31,Chennai,B.Tech,"JavaScript, Accounting, Finance",E-commerce,1,15294-32887,Online,2025-03-09,Marketing,"This internship requires skills in Excel, Data Analysis, Marketing, Communication, HTML and relevant experience.",Certificate,2
32,Internship 32,Company 32,Pune,B.Tech,"Excel, C++, Java, Python, SEO",Marketing,2,17463-32140,Hybrid,2025-01-17,Education,"This internship requires skills in Finance, AI and relevant experience.",Stipend,8
33,Internship 33,Company 33,Kolkata,PhD,"Deep Learning, C++, UI/UX, Excel, SEO",Operations,6,13840-43847,Online,2025-10-15,Marketing,"This internship requires skills in Deep Learning, Java and relevant experience.",Networking,7
34,Internship 34,Company 34,Chennai,MBA,"Data Analysis, SQL",E-commerce,3,13176-33332,Online,2025-11-25,Finance,"This internship requires skills in Python, Marketing, C++ and relevant experience.",Stipend,7
35,Internship 35,Company 35,Kolkata,BBA,"SEO, Python, C++, Finance, UI/UX",Marketing,6,5687-29166,Online,2025-02-16,Education,"This internship requires skills in Python, ML, AI and relevant experience.",Stipend,5
36,Internship 36,Company 36,Bangalore,PhD,"Python, C++",Marketing,5,13234-26630,Offline,2025-04-04,Marketing,"This internship requires skills in SEO, Java and relevant experience.",Letter of Recommendation,10
37,Internship 37,Company 37,Pune,BBA,"UI/UX, Excel, CSS, Finance",Education,1,17637-37690,Hybrid,2025-06-10,Healthcare,"This internship requires skills in Deep Learning, SEO and relevant experience.",Flexible Hours,6
38,Internship 38,Company 38,Hyderabad,PhD,"Java, Python, UI/UX, Data Analysis, SEO",E-commerce,1,7447-43940,Online,2025-05-06,AI,"This internship requires skills in ML, UI/UX, Accounting, HTML, Python and relevant experience.",Flexible Hours,10
39,Internship 39,Company 39,Pune,B.Tech,"Python, ML",Healthcare,5,10053-37666,Hybrid,2025-04-15,Finance,"This internship requires skills in CSS, Java and relevant experience.",Networking,10
40,Internship 40,Company 40,Kolkata,PhD,"HTML, Java",Research,1,12891-42142,Online,2025-03-10,Healthcare,"This internship requires skills in Communication, Project Management, HTML, NLP and relevant experience.",Letter of Recommendation,4
41,Internship 41,Company 41,Chennai,B.Com,"JavaScript, Deep Learning, Finance, SEO",AI,3,17008-33151,Online,2025-11-03,Marketing,"This internship requires skills in Marketing, Project Management and relevant experience.",Networking,8
42,Internship 42,Company 42,Pune,BBA,"AI, CSS, Marketing",AI,3,7325-20708,Online,2025-09-19,Tech,"This internship requires skills in Python, Communication, Excel and relevant experience.",Certificate,7
43,Internship 43,Company 43,Pune,MBA,"Deep Learning, NLP, Excel",Operations,1,11631-37532,Offline,2025-06-04,Finance,"This internship requires skills in Finance, Marketing and relevant experience.",Flexible Hours,8
44,Internship 44,Company 44,Delhi,PhD,"HTML, AI, JavaScript, SEO",Technology,1,10790-33082,Offline,2025-07-27,Marketing,"This internship requires skills in Marketing, Communication, SQL, HTML and relevant experience.",Stipend,9
45,Internship 45,Company 45,Mumbai,PhD,"NLP, UI/UX, SEO",AI,5,12676-38132,Hybrid,2025-10-26,AI,"This internship requires skills in ML, Python, Marketing, Java and relevant experience.",Networking,2
46,Internship 46,Company 46,Chennai,B.Tech,"SQL, ML, Finance, C++, HTML",Operations,5,18707-35686,Online,2025-09-12,Tech,"This internship requires skills in Project Management, Python, Finance, Deep Learning, Accounting and relevant experience.",Flexible Hours,5
47,Internship 47,Company 47,Pune,B.Com,"Java, C++, UI/UX, Communication, SQL",Education,6,17868-39988,Hybrid,2025-03-28,Marketing,"This internship requires skills in CSS, Python, Excel, ML, HTML and relevant experience.",Flexible Hours,1
48,Internship 48,Company 48,Pune,B.Tech,"CSS, Finance, SEO, Communication",Marketing,6,8152-29884,Offline,2025-02-21,Healthcare,"This internship requires skills in Java, Marketing, Project Management, Python and relevant experience.",Letter of Recommendation,10
49,Internship 49,Company 49,Hyderabad,PhD,"ML, Data Analysis, Excel, NLP, SEO",AI,2,11240-29397,Hybrid,2025-06-04,Education,"This internship requires skills in Deep Learning, UI/UX and relevant experience.",Certificate,4
50,Internship 50,Company 50,Mumbai,M.Com,"NLP, ML, Marketing",Research,4,7831-20619,Offline,2025-07-28,Healthcare,"This internship requires skills in Communication, Project Management, CSS, NLP, Marketing and relevant experience.",Letter of Recommendation,9
51,Internship 51,Company 51,Mumbai,PhD,"Finance, Accounting, SQL, Project Management, NLP",E-commerce,6,6835-28323,Offline,2025-06-25,Tech,"This internship requires skills in Accounting, UI/UX, Communication and relevant experience.",Flexible Hours,10
52,Internship 52,Company 52,Mumbai,B.Tech,"Deep Learning, SEO, Java, Communication",Design,3,11124-32715,Online,2025-04-17,Healthcare,"This internship requires skills in Data Analysis, Accounting, Finance, CSS and relevant experience.",Networking,8
53,Internship 53,Company 53,Chennai,M.Com,"Accounting, NLP, AI",Operations,3,11557-42414,Online,2025-10-13,AI,"This internship requires skills in Deep Learning, ML and relevant experience.",Letter of Recommendation,3
54,Internship 54,Company 54,Kolkata,BBA,"Finance, Deep Learning, Accounting",Finance,6,7242-45490,Hybrid,2025-02-01,Healthcare,"This internship requires skills in ML, HTML, Accounting and relevant experience.",Certificate,9
55,Internship 55,Company 55,Chennai,MBA,"UI/UX, Excel, Accounting, C++",Design,6,16553-41300,Online,2025-03-20,Healthcare,"This internship requires skills in Marketing, JavaScript, Finance, Communication, Project Management and relevant experience.",Certificate,5
56,Internship 56,Company 56,Mumbai,M.Tech,"SEO, JavaScript, CSS, UI/UX, Data Analysis",Marketing,3,12914-49031,Offline,2025-07-28,Marketing,"This internship requires skills in HTML, AI, Communication and relevant experience.",Letter of Recommendation,10
57,Internship 57,Company 57,Kolkata,B.Com,"ML, CSS, HTML, Finance, NLP",Healthcare,6,15611-36495,Offline,2025-02-02,Marketing,"This internship requires skills in Communication, SQL, Deep Learning, Finance, Marketing and relevant experience.",Letter of Recommendation,8
58,Internship 58,Company 58,Bangalore,PhD,"Finance, HTML, SEO, AI, Deep Learning",AI,4,7158-40422,Hybrid,2025-07-02,Marketing,"This internship requires skills in Communication, Accounting, SEO and relevant experience.",Networking,10
59,Internship 59,Company 59,Delhi,M.Tech,"UI/UX, ML, Java, JavaScript",AI,6,11984-46440,Online,2025-12-26,Education,"This internship requires skills in Communication, HTML, Excel, JavaScript, Marketing and relevant experience.",Stipend,2
60,Internship 60,Company 60,Delhi,PhD,"Data Analysis, Finance, C++, Python",Design,4,14803-45319,Hybrid,2025-12-17,Healthcare,"This internship requires skills in Accounting, Marketing, HTML and relevant experience.",Letter of Recommendation,7
61,Internship 61,Company 61,Mumbai,BBA,"SEO, Data Analysis",Finance,6,16587-33146,Offline,2025-08-27,Education,"This internship requires skills in JavaScript, NLP and relevant experience.",Stipend,6
62,Internship 62,Company 62,Mumbai,B.Com,"Communication, Marketing, C++, Data Analysis",Healthcare,5,10886-31683,Offline,2025-01-05,Education,"This internship requires skills in Finance, NLP, C++ and relevant experience.",Letter of Recommendation,10
63,Internship 63,Company 63,Kolkata,MBA,"Accounting, HTML",Healthcare,1,11907-31298,Hybrid,2025-07-26,AI,"This internship requires skills in AI, UI/UX, Accounting and relevant experience.",Flexible Hours,7
64,Internship 64,Company 64,Hyderabad,B.Tech,"Deep Learning, UI/UX, Accounting",Design,2,7314-41478,Online,2025-05-13,Marketing,"This internship requires skills in Finance, AI and relevant experience.",Stipend,7
65,Internship 65,Company 65,Mumbai,B.Tech,"Accounting, HTML",AI,2,9844-45788,Online,2025-08-24,Finance,"This internship requires skills in CSS, Java and relevant experience.",Letter of Recommendation,6
66,Internship 66,Company 66,Mumbai,B.Com,"Finance, Excel, C++",Research,2,13576-29523,Offline,2025-04-10,Finance,"This internship requires skills in Accounting, Marketing, Finance, ML and relevant experience.",Letter of Recommendation,9
67,Internship 67,Company 67,Mumbai,B.Tech,"ML, C++, JavaScript",Technology,5,5858-46607,Hybrid,2025-12-27,Marketing,"This internship requires skills in JavaScript, Java, Communication and relevant experience.",Flexible Hours,9
68,Internship 68,Company 68,Delhi,BBA,"Marketing, JavaScript",Design,6,11415-26533,Online,2025-02-13,Finance,"This internship requires skills in Communication, Data Analysis and relevant experience.",Stipend,7
69,Internship 69,Company 69,Chennai,MBA,"CSS, Excel, Project Management",Research,1,12403-42162,Offline,2025-06-07,Finance,"This internship requires skills in Python, UI/UX, C++, Communication and relevant experience.",Certificate,3
70,Internship 70,Company 70,Hyderabad,MBA,"NLP, SEO, Data Analysis, Project Management, Communication",E-commerce,3,10805-35687,Offline,2025-04-03,Education,"This internship requires skills in Python, SEO, HTML, Project Management and relevant experience.",Stipend,4
71,Internship 71,Company 71,Mumbai,B.Com,"SQL, Accounting, NLP",Research,1,5924-35372,Online,2025-09-23,Tech,"This internship requires skills in Java, CSS and relevant experience.",Certificate,9
72,Internship 72,Company 72,Hyderabad,M.Tech,"Excel, Java, C++, CSS, Python",Marketing,4,13705-49017,Online,2025-08-16,Tech,"This internship requires skills in Deep Learning, NLP and relevant experience.",Letter of Recommendation,4
73,Internship 73,Company 73,Pune,B.Tech,"NLP, ML, UI/UX, Accounting",Design,1,19447-21077,Hybrid,2025-05-13,Healthcare,"This internship requires skills in NLP, Accounting, Data Analysis and relevant experience.",Flexible Hours,10
74,Internship 74,Company 74,Mumbai,B.Tech,"CSS, Finance, SEO, Python, Java",Technology,2,17648-35084,Offline,2025-06-19,AI,"This internship requires skills in Excel, Communication, Finance, SEO and relevant experience.",Certificate,8
75,Internship 75,Company 75,Hyderabad,BBA,"Java, CSS, Project Management, Communication, Data Analysis",Marketing,1,15276-24466,Hybrid,2025-11-12,Tech,"This internship requires skills in AI, Finance, JavaScript, Python, CSS and relevant experience.",Networking,10
76,Internship 76,Company 76,Mumbai,PhD,"Finance, Data Analysis",Education,3,7705-44223,Offline,2025-08-19,Tech,"This internship requires skills in Marketing, Accounting, UI/UX, AI and relevant experience.",Flexible Hours,2
77,Internship 77,Company 77,Delhi,M.Com,"SQL, AI, JavaScript, Accounting, Communication",E-commerce,5,18293-26047,Offline,2025-04-15,AI,"This internship requires skills in Data Analysis, Finance, NLP and relevant experience.",Networking,9
78,Internship 78,Company 78,Mumbai,PhD,"ML, NLP, Accounting",Education,5,6164-39482,Hybrid,2025-09-18,Healthcare,"This internship requires skills in Python, C++, JavaScript, Accounting and relevant experience.",Networking,10
79,Internship 79,Company 79,Mumbai,M.Tech,"Accounting, SQL, Python",Healthcare,3,10453-45410,Offline,2025-02-13,Marketing,"This internship requires skills in NLP, Finance and relevant experience.",Networking,2
80,Internship 80,Company 80,Pune,MBA,"Python, Data Analysis",Technology,2,13170-31588,Hybrid,2025-07-04,Healthcare,"This internship requires skills in SEO, Project Management, Excel, Finance, NLP and relevant experience.",Letter of Recommendation,6
81,Internship 81,Company 81,Kolkata,BBA,"HTML, NLP, Java",Design,1,9937-30387,Hybrid,2025-09-09,AI,"This internship requires skills in Java, HTML, Marketing and relevant experience.",Networking,4
82,Internship 82,Company 82,Delhi,MBA,"JavaScript, AI",E-commerce,5,13796-30234,Online,2025-09-19,Healthcare,"This internship requires skills in Finance, AI and relevant experience.",Certificate,1
83,Internship 83,Company 83,Delhi,B.Tech,"Communication, Data Analysis, Excel, UI/UX",Design,2,12847-39246,Offline,2025-02-11,AI,"This internship requires skills in Finance, Java, Excel and relevant experience.",Flexible Hours,10
84,Internship 84,Company 84,Pune,MBA,"Java, Project Management, CSS, C++, Excel",Operations,2,12699-34200,Offline,2025-03-10,Education,"This internship requires skills in Deep Learning, ML and relevant experience.",Flexible Hours,5
85,Internship 85,Company 85,Bangalore,M.Com,"SQL, HTML, Python, UI/UX",E-commerce,5,15216-40138,Online,2025-06-26,Healthcare,"This internship requires skills in Project Management, HTML, Java and relevant experience.",Stipend,2
86,Internship 86,Company 86,Pune,B.Tech,"Deep Learning, Finance, Data Analysis",E-commerce,2,15601-37789,Offline,2025-01-08,Education,"This internship requires skills in NLP, Data Analysis, HTML, Deep Learning, Finance and relevant experience.",Stipend,7
87,Internship 87,Company 87,Delhi,MBA,"HTML, SEO, Project Management, UI/UX, SQL",Marketing,4,9017-45524,Online,2025-04-17,Finance,"This internship requires skills in UI/UX, Java and relevant experience.",Letter of Recommendation,5
88,Internship 88,Company 88,Pune,M.Com,"CSS, SEO",Research,5,6792-30610,Hybrid,2025-08-24,Tech,"This internship requires skills in CSS, SQL and relevant experience.",Networking,1
89,Internship 89,Company 89,Bangalore,MBA,"Project Management, Java",Operations,3,16716-43828,Offline,2025-08-21,Finance,"This internship requires skills in Deep Learning, SEO, SQL and relevant experience.",Stipend,2
90,Internship 90,Company 90,Pune,MBA,"Excel, Data Analysis",Design,4,11851-33330,Hybrid,2025-12-05,AI,"This internship requires skills in Java, Deep Learning, Accounting, Python, Excel and relevant experience.",Certificate,5
91,Internship 91,Company 91,Chennai,BBA,"AI, Deep Learning, Python",Design,4,17983-27410,Online,2025-05-07,Healthcare,"This internship requires skills in Python, Marketing, AI, Accounting, Deep Learning and relevant experience.",Stipend,9
92,Internship 92,Company 92,Kolkata,M.Tech,"Accounting, SEO, Communication",Marketing,1,10039-41246,Hybrid,2025-02-23,Healthcare,"This internship requires skills in C++, JavaScript, NLP, Excel, Data Analysis and relevant experience.",Flexible Hours,7
93,Internship 93,Company 93,Hyderabad,MBA,"HTML, Python, SEO",Education,5,6941-45250,Hybrid,2025-03-04,Education,"This internship requires skills in Java, NLP, Python and relevant experience.",Letter of Recommendation,7
94,Internship 94,Company 94,Kolkata,M.Com,"SQL, Project Management",Finance,5,6179-20905,Hybrid,2025-02-22,Marketing,"This internship requires skills in SEO, HTML and relevant experience.",Certificate,7
95,Internship 95,Company 95,Bangalore,M.Com,"Excel, SQL, AI",E-commerce,6,19699-43334,Offline,2025-08-11,Education,"This internship requires skills in C++, Finance and relevant experience.",Certificate,7
96,Internship 96,Company 96,Mumbai,BBA,"Python, Excel, Communication, SEO, Deep Learning",Design,1,7254-30795,Online,2025-09-16,Education,"This internship requires skills in Java, Project Management and relevant experience.",Flexible Hours,9
97,Internship 97,Company 97,Pune,PhD,"UI/UX, JavaScript, NLP, Marketing, Python",E-commerce,4,19070-24211,Online,2025-03-27,Education,"This internship requires skills in Python, CSS, SQL, JavaScript, AI and relevant experience.",Networking,4
98,Internship 98,Company 98,Delhi,BBA,"UI/UX, Data Analysis, Deep Learning, AI",Marketing,3,8078-20204,Online,2025-08-12,Tech,"This internship requires skills in SEO, Data Analysis, C++, Deep Learning, UI/UX and relevant experience.",Stipend,7
99,Internship 99,Company 99,Bangalore,BBA,"Finance, CSS, SQL, NLP, ML",Education,1,18572-21711,Offline,2025-12-01,Marketing,"This internship requires skills in Excel, Marketing, HTML, UI/UX and relevant experience.",Flexible Hours,6
100,Internship 100,Company 100,Hyderabad,MBA,"HTML, Data Analysis",Design,3,17898-30056,Online,2025-01-19,Marketing,"This internship requires skills in Project Management, Excel and relevant experience.",Stipend,9
101,Internship 101,Company 101,Pune,MBA,"HTML, Finance, SQL",E-commerce,1,15645-39381,Hybrid,2025-08-15,Healthcare,"This internship requires skills in JavaScript, Communication and relevant experience.",Stipend,5
102,Internship 102,Company 102,Pune,M.Com,"JavaScript, Finance, Communication, Project Management, Data Analysis",Marketing,1,18631-38108,Online,2025-04-26,Marketing,"This internship requires skills in JavaScript, Data Analysis, C++ and relevant experience.",Flexible Hours,6
103,Internship 103,Company 103,Kolkata,B.Tech,"AI, Data Analysis",Marketing,5,17191-47209,Online,2025-11-24,Healthcare,"This internship requires skills in C++, SEO, Communication and relevant experience.",Certificate,3
104,Internship 104,Company 104,Mumbai,M.Com,"Java, Data Analysis, JavaScript, UI/UX",Design,4,19417-49766,Hybrid,2025-05-24,AI,"This internship requires skills in SEO, C++, SQL and relevant experience.",Networking,4
105,Internship 105,Company 105,Pune,BBA,"Project Management, Data Analysis",E-commerce,1,11625-47673,Online,2025-04-25,AI,"This internship requires skills in AI, Java, SQL, Python and relevant experience.",Stipend,3
106,Internship 106,Company 106,Kolkata,PhD,"C++, CSS, Marketing",Design,1,16847-41257,Online,2025-02-12,Education,"This internship requires skills in Deep Learning, Communication, Project Management, Marketing and relevant experience.",Certificate,5
107,Internship 107,Company 107,Delhi,B.Com,"HTML, AI",Design,1,8415-25556,Online,2025-02-25,AI,"This internship requires skills in NLP, SEO, Python, ML and relevant experience.",Networking,1
108,Internship 108,Company 108,Bangalore,PhD,"Deep Learning, Accounting, Project Management, UI/UX",Healthcare,1,11932-46304,Hybrid,2025-11-26,Healthcare,"This internship requires skills in Accounting, Java, JavaScript and relevant experience.",Certificate,2
109,Internship 109,Company 109,Hyderabad,MBA,"Project Management, Excel, Marketing, SEO",Healthcare,6,10087-36578,Online,2025-09-17,Finance,"This internship requires skills in Python, ML, Accounting and relevant experience.",Letter of Recommendation,1
110,Internship 110,Company 110,Pune,BBA,"SQL, Marketing, JavaScript",E-commerce,6,19909-24924,Offline,2025-01-13,Tech,"This internship requires skills in Accounting, ML, Deep Learning, Project Management and relevant experience.",Stipend,4
111,Internship 111,Company 111,Delhi,PhD,"Data Analysis, Accounting",E-commerce,2,6115-38001,Hybrid,2025-06-08,Education,"This internship requires skills in Project Management, Java, SQL and relevant experience.",Certificate,4
112,Internship 112,Company 112,Mumbai,B.Com,"AI, Marketing",Education,6,7830-29757,Offline,2025-01-18,Tech,"This internship requires skills in Excel, Data Analysis, Python, Marketing and relevant experience.",Networking,1
