Internship_ID,Title,Company,Location,Education_Level,Skills_Required,Sector,Duration_Months,Stipend_Range,Mode,Application_Deadline,Industry,Job_Description,Benefits,Number_of_Openings
445,Internship 445,Company 445,Delhi,PhD,"SQL, Project Management",AI,3,11576-26990,Hybrid,2025-05-13,Marketing,"This internship requires skills in Python, Project Management, NLP, Excel and relevant experience.",Letter of Recommendation,5
446,Internship 446,Company 446,Chennai,M.Tech,"Accounting, Communication",Marketing,2,7962-48080,Online,2025-02-08,Tech,"This internship requires skills in C++, Deep Learning, Python and relevant experience.",Stipend,4
447,Internship 447,Company 447,Delhi,MBA,"Accounting, NLP",Finance,3,9263-27609,Online,2025-09-28,Marketing,"This internship requires skills in HTML, CSS, Java, SQL and relevant experience.",Flexible Hours,6
448,Internship 448,Company 448,Hyderabad,B.Tech,"ML, Python, Accounting, Data Analysis",Finance,1,11615-34228,Online,2025-11-04,AI,"This internship requires skills in Deep Learning, JavaScript, Finance, Marketing and relevant experience.",Flexible Hours,7
449,Internship 449,Company 449,Kolkata,PhD,"Data Analysis, C++, Python",Design,6,7614-26264,Offline,2025-05-26,Healthcare,"This internship requires skills in JavaScript, AI, Project Management, Accounting, NLP and relevant experience.",Flexible Hours,5
450,Internship 450,Company 450,Chennai,B.Com,"CSS, Data Analysis",Research,6,6477-29570,Online,2025-11-02,Healthcare,"This internship requires skills in Finance, Java, AI, JavaScript and relevant experience.",Stipend,4
451,Internship 451,Company 451,Mumbai,B.Tech,"C++, HTML",E-commerce,1,11466-30029,Online,2025-11-17,Tech,"This internship requires skills in Communication, Java, Project Management and relevant experience.",Networking,5
452,Internship 452,Company 452,Mumbai,PhD,"Finance, SEO",Marketing,4,7872-32421,Hybrid,2025-08-22,Marketing,"This internship requires skills in ML, Data Analysis, Java, Marketing and relevant experience.",Stipend,9
453,Internship 453,Company 453,Bangalore,B.Tech,"Accounting, ML, AI",Marketing,3,15274-32266,Offline,2025-08-18,Tech,"This internship requires skills in CSS, Accounting, JavaScript, NLP, Data Analysis and relevant experience.",Stipend,1
454,Internship 454,Company 454,Delhi,B.Tech,"C++, Marketing, Project Management",Technology,6,8329-43038,Hybrid,2025-03-06,Healthcare,"This internship requires skills in Data Analysis, SQL, AI, C++ and relevant experience.",Certificate,7
455,Internship 455,Company 455,Bangalore,PhD,"UI/UX, Project Management, Java, CSS, Data Analysis",Research,6,12230-35883,Hybrid,2025-06-23,Finance,"This internship requires skills in Excel, Marketing, JavaScript and relevant experience.",Letter of Recommendation,8
456,Internship 456,Company 456,Mumbai,BBA,"UI/UX, Java, Project Management, AI, C++",Design,4,12623-35929,Offline,2025-10-13,Education,"This internship requires skills in NLP, ML, Data Analysis, Finance, C++ and relevant experience.",Stipend,3
457,Internship 457,Company 457,Kolkata,B.Tech,"Accounting, ML, Java",Operations,2,19807-30780,Hybrid,2025-03-19,AI,"This internship requires skills in C++, Communication, SQL, AI and relevant experience.",Stipend,2
458,Internship 458,Company 458,Mumbai,BBA,"AI, Excel",Finance,3,5378-48281,Online,2025-05-01,AI,"This internship requires skills in ML, SQL, Data Analysis, CSS and relevant experience.",Stipend,5
459,Internship 459,Company 459,Pune,PhD,"Marketing, C++, CSS, NLP",Operations,2,12933-37286,Offline,2025-07-10,Marketing,"This internship requires skills in SQL, Accounting, HTML, ML, Marketing and relevant experience.",Stipend,10
460,Internship 460,Company 460,Chennai,MBA,"CSS, Finance, AI, NLP",AI,4,5018-37248,Offline,2025-04-22,AI,"This internship requires skills in Finance, HTML and relevant experience.",Letter of Recommendation,4
461,Internship 461,Company 461,Delhi,B.Com,"Data Analysis, NLP",Healthcare,3,8488-49106,Online,2025-04-18,Finance,"This internship requires skills in Data Analysis, SQL, Java, JavaScript, C++ and relevant experience.",Flexible Hours,1
462,Internship 462,Company 462,Kolkata,PhD,"Finance, Project Management, AI, Python",AI,2,7201-47639,Offline,2025-02-25,Tech,"This internship requires skills in NLP, Marketing, SQL, Data Analysis, Deep Learning and relevant experience.",Letter of Recommendation,1
463,Internship 463,Company 463,Pune,B.Tech,"JavaScript, UI/UX, Marketing, SQL, Deep Learning",Healthcare,6,5760-46149,Offline,2025-08-02,Finance,"This internship requires skills in HTML, NLP, CSS, Communication and relevant experience.",Networking,2
464,Internship 464,Company 464,Hyderabad,M.Tech,"Excel, HTML, SQL, Project Management, Data Analysis",E-commerce,2,10148-34621,Online,2025-05-24,AI,"This internship requires skills in SQL, Marketing and relevant experience.",Networking,4
465,Internship 465,Company 465,Kolkata,MBA,"Communication, Accounting",AI,6,11310-33132,Offline,2025-09-11,Marketing,"This internship requires skills in Deep Learning, SEO, Excel and relevant experience.",Stipend,4
466,Internship 466,Company 466,Mumbai,M.Tech,"ML, Marketing, HTML, Python",Education,6,14397-24058,Offline,2025-01-15,AI,"This internship requires skills in Python, UI/UX and relevant experience.",Networking,9
467,Internship 467,Company 467,Pune,MBA,"Java, Deep Learning",Operations,3,8225-45507,Hybrid,2025-10-01,Finance,"This internship requires skills in Java, SQL, JavaScript and relevant experience.",Networking,4
468,Internship 468,Company 468,Chennai,B.Tech,"HTML, JavaScript",Education,5,14236-34573,Online,2025-11-01,AI,"This internship requires skills in C++, JavaScript, HTML, Project Management, Data Analysis and relevant experience.",Stipend,6
469,Internship 469,Company 469,Bangalore,M.Com,"C++, CSS, Marketing",AI,6,14922-25160,Hybrid,2025-09-17,Marketing,"This internship requires skills in JavaScript, Marketing and relevant experience.",Letter of Recommendation,3
470,Internship 470,Company 470,Chennai,BBA,"C++, Python",Design,2,19862-25845,Online,2025-05-18,Healthcare,"This internship requires skills in AI, HTML and relevant experience.",Stipend,5
471,Internship 471,Company 471,Bangalore,M.Com,"NLP, AI, C++, Data Analysis, Finance",Research,6,8871-37621,Offline,2025-08-20,Tech,"This internship requires skills in Data Analysis, SQL, UI/UX, Java and relevant experience.",Letter of Recommendation,5
472,Internship 472,Company 472,Chennai,M.Tech,"Deep Learning, Communication",Design,5,7425-43959,Offline,2025-05-18,Tech,"This internship requires skills in SQL, Communication and relevant experience.",Letter of Recommendation,7
473,Internship 473,Company 473,Bangalore,B.Tech,"HTML, Finance, Accounting, AI, Java",Education,6,18051-29008,Offline,2025-06-12,Marketing,"This internship requires skills in Accounting, Java, SEO, ML, UI/UX and relevant experience.",Certificate,6
474,Internship 474,Company 474,Pune,M.Tech,"HTML, Accounting, SQL, SEO, UI/UX",Technology,2,15260-29246,Hybrid,2025-12-04,AI,"This internship requires skills in Communication, SEO and relevant experience.",Flexible Hours,1
475,Internship 475,Company 475,Delhi,PhD,"Marketing, Accounting",Research,2,6947-42204,Hybrid,2025-10-21,Finance,"This internship requires skills in NLP, Communication, Project Management and relevant experience.",Certificate,4
476,Internship 476,Company 476,Bangalore,M.Com,"JavaScript, Excel, Project Management",Technology,2,12700-22635,Online,2025-04-18,Tech,"This internship requires skills in Python, Data Analysis, UI/UX and relevant experience.",Certificate,4
477,Internship 477,Company 477,Kolkata,B.Tech,"SEO, Accounting, Data Analysis, C++",Operations,6,12817-32273,Online,2025-05-07,Finance,"This internship requires skills in HTML, Communication, ML and relevant experience.",Letter of Recommendation,4
478,Internship 478,Company 478,Bangalore,BBA,"C++, UI/UX, ML, Communication, NLP",E-commerce,4,10965-30544,Offline,2025-12-04,AI,"This internship requires skills in UI/UX, Accounting and relevant experience.",Letter of Recommendation,9
479,Internship 479,Company 479,Mumbai,BBA,"Project Management, JavaScript",Operations,1,14776-35298,Offline,2025-09-04,Tech,"This internship requires skills in SEO, Finance and relevant experience.",Certificate,3
480,Internship 480,Company 480,Pune,BBA,"SQL, Communication, ML, UI/UX, Java",AI,2,7071-44659,Online,2025-06-12,Finance,"This internship requires skills in AI, Python and relevant experience.",Stipend,8
481,Internship 481,Company 481,Hyderabad,B.Com,"AI, Deep Learning, Communication, C++",Healthcare,5,13976-39596,Offline,2025-07-13,Healthcare,"This internship requires skills in AI, JavaScript, Data Analysis, SQL and relevant experience.",Letter of Recommendation,10
482,Internship 482,Company 482,Kolkata,PhD,"Data Analysis, Project Management",Technology,5,6280-46275,Offline,2025-02-09,Education,"This internship requires skills in Project Management, C++, HTML, SQL and relevant experience.",Networking,7
483,Internship 483,Company 483,Mumbai,M.Com,"Communication, NLP, HTML, Project Management, SEO",Design,5,14952-28716,Online,2025-09-22,Tech,"This internship requires skills in Marketing, Accounting, SEO, ML and relevant experience.",Stipend,1
484,Internship 484,Company 484,Delhi,BBA,"C++, JavaScript, Data Analysis, SEO",Marketing,3,13703-34496,Offline,2025-05-12,AI,"This internship requires skills in Finance, Python, Data Analysis and relevant experience.",Letter of Recommendation,5
485,Internship 485,Company 485,Bangalore,B.Com,"AI, Java, SEO, Deep Learning, Python",Finance,4,10351-31738,Online,2025-05-10,Tech,"This internship requires skills in NLP, Excel, UI/UX and relevant experience.",Networking,7
486,Internship 486,Company 486,Mumbai,BBA,"CSS, Marketing, Excel, NLP, SQL",Operations,4,19765-34967,Offline,2025-06-08,Finance,"This internship requires skills in UI/UX, NLP, Data Analysis, SQL and relevant experience.",Stipend,9
487,Internship 487,Company 487,Chennai,M.Tech,"CSS, Marketing, ML",Healthcare,5,18820-25492,Online,2025-04-22,Education,"This internship requires skills in Data Analysis, Deep Learning, ML and relevant experience.",Stipend,4
488,Internship 488,Company 488,Mumbai,B.Com,"Python, C++, UI/UX, Java",Marketing,2,7575-29402,Offline,2025-03-14,Marketing,"This internship requires skills in Finance, CSS, Project Management, Marketing and relevant experience.",Letter of Recommendation,9
489,Internship 489,Company 489,Mumbai,B.Tech,"Marketing, SQL, Excel",Design,1,14487-36035,Online,2025-05-22,Education,"This internship requires skills in Finance, JavaScript and relevant experience.",Flexible Hours,8
490,Internship 490,Company 490,Bangalore,M.Com,"C++, Deep Learning",Education,6,10741-27178,Hybrid,2025-07-03,Healthcare,"This internship requires skills in Java, Data Analysis, HTML, C++ and relevant experience.",Flexible Hours,4
491,Internship 491,Company 491,Delhi,B.Com,"AI, JavaScript, Data Analysis, Deep Learning",Design,4,9316-41851,Hybrid,2025-08-19,AI,"This internship requires skills in Accounting, Deep Learning, AI and relevant experience.",Certificate,8
492,Internship 492,Company 492,Chennai,PhD,"UI/UX, Python, Accounting, HTML, SEO",Marketing,3,18889-29275,Online,2025-06-12,Healthcare,"This internship requires skills in Data Analysis, SEO and relevant experience.",Letter of Recommendation,4
493,Internship 493,Company 493,Mumbai,M.Com,"Python, UI/UX",Education,3,14701-20832,Online,2025-02-14,Education,"This internship requires skills in Accounting, Python, Marketing and relevant experience.",Letter of Recommendation,6
494,Internship 494,Company 494,Kolkata,B.Com,"HTML, Python",Education,5,11194-30520,Offline,2025-04-21,Finance,"This internship requires skills in JavaScript, Marketing, Excel, Python, C++ and relevant experience.",Letter of Recommendation,5
495,Internship 495,Company 495,Delhi,M.Com,"Finance, Deep Learning, Project Management, Communication, CSS",Education,5,5487-37341,Hybrid,2025-03-09,Finance,"This internship requires skills in C++, Excel, JavaScript and relevant experience.",Stipend,1
496,Internship 496,Company 496,Kolkata,BBA,"Excel, UI/UX, Marketing, Java",Finance,1,10341-33865,Offline,2025-08-07,Healthcare,"This internship requires skills in Project Management, Python, Java, AI and relevant experience.",Networking,2
497,Internship 497,Company 497,Chennai,M.Tech,"AI, ML, Data Analysis, HTML",Finance,6,15841-20238,Hybrid,2025-11-04,Finance,"This internship requires skills in SEO, C++, Python and relevant experience.",Certificate,1
498,Internship 498,Company 498,Hyderabad,B.Tech,"Project Management, Java",Research,6,8518-35734,Offline,2025-04-01,AI,"This internship requires skills in C++, Python, Project Management, NLP and relevant experience.",Flexible Hours,10
499,Internship 499,Company 499,Bangalore,B.Tech,"CSS, Finance, Java, AI, Python",E-commerce,1,12892-30290,Hybrid,2025-04-08,Healthcare,"This internship requires skills in Accounting, SEO, Communication, Data Analysis and relevant experience.",Networking,9
500,Internship 500,Company 500,Pune,MBA,"Python, Data Analysis",Healthcare,2,16259-33898,Online,2025-11-17,Finance,"This internship requires skills in JavaScript, Project Management and relevant experience.",Networking,3
501,Internship 501,Company 501,Hyderabad,PhD,"CSS, Python, Excel, ML",AI,6,15773-35357,Offline,2025-12-24,Tech,"This internship requires skills in HTML, JavaScript, SEO and relevant experience.",Stipend,8
502,Internship 502,Company 502,Kolkata,B.Tech,"Marketing, JavaScript",Finance,6,12190-28448,Online,2025-10-22,Education,"This internship requires skills in Deep Learning, SQL, HTML, Excel and relevant experience.",Letter of Recommendation,10
503,Internship 503,Company 503,Bangalore,M.Com,"Finance, Data Analysis, Python, Marketing, ML",Finance,5,10056-49218,Online,2025-11-04,Marketing,"This internship requires skills in UI/UX, Finance and relevant experience.",Certificate,7
504,Internship 504,Company 504,Delhi,BBA,"C++, Communication, Data Analysis, SQL, HTML",E-commerce,3,11965-29956,Hybrid,2025-03-09,Finance,"This internship requires skills in SQL, AI and relevant experience.",Letter of Recommendation,1
505,Internship 505,Company 505,Bangalore,M.Tech,"NLP, Java, SEO, JavaScript, C++",Operations,6,18705-27718,Hybrid,2025-07-20,Education,"This internship requires skills in HTML, Python, Communication and relevant experience.",Stipend,9
506,Internship 506,Company 506,Hyderabad,B.Com,"SEO, HTML",Operations,5,14754-39908,Online,2025-09-07,AI,"This internship requires skills in CSS, ML, Accounting and relevant experience.",Networking,5
507,Internship 507,Company 507,Hyderabad,B.Com,"Java, Data Analysis, Deep Learning, SEO",E-commerce,1,8721-40243,Online,2025-02-02,Tech,"This internship requires skills in ML, Excel, Python, Finance, Marketing and relevant experience.",Flexible Hours,7
508,Internship 508,Company 508,Hyderabad,MBA,"Communication, NLP",Marketing,2,8598-49340,Offline,2025-03-13,Education,"This internship requires skills in Java, Finance, SQL, Marketing, CSS and relevant experience.",Flexible Hours,10
509,Internship 509,Company 509,Pune,M.Com,"Accounting, CSS",Operations,4,5303-22304,Offline,2025-07-12,Marketing,"This internship requires skills in Excel, Communication, ML, UI/UX, Deep Learning and relevant experience.",Flexible Hours,8
510,Internship 510,Company 510,Pune,PhD,"Project Management, Excel",Finance,6,16028-22295,Offline,2025-10-12,Tech,"This internship requires skills in HTML, Accounting, Marketing, SQL and relevant experience.",Stipend,4
511,Internship 511,Company 511,Chennai,BBA,"JavaScript, C++",Technology,4,13029-27906,Online,2025-05-02,AI,"This internship requires skills in SQL, C++ and relevant experience.",Stipend,3
512,Internship 512,Company 512,Delhi,M.Com,"ML, HTML",Design,4,16667-25841,Online,2025-02-26,Marketing,"This internship requires skills in Python, SEO and relevant experience.",Networking,1
513,Internship 513,Company 513,Kolkata,MBA,"HTML, AI, SQL, Java, Accounting",Healthcare,1,14321-33870,Hybrid,2025-03-02,Tech,"This internship requires skills in CSS, SEO and relevant experience.",Letter of Recommendation,4
514,Internship 514,Company 514,Bangalore,B.Tech,"CSS, Excel, Python, SEO, SQL",Education,3,17515-36701,Online,2025-11-16,Finance,"This internship requires skills in Project Management, ML, HTML, Finance, Java and relevant experience.",Letter of Recommendation,9
515,Internship 515,Company 515,Kolkata,PhD,"Communication, Project Management, NLP, HTML, Java",Healthcare,5,12056-45545,Online,2025-11-07,Education,"This internship requires skills in Deep Learning, SQL, Finance, Data Analysis, Marketing and relevant experience.",Stipend,7
516,Internship 516,Company 516,Hyderabad,M.Tech,"Project Management, NLP, Deep Learning, Communication, C++",Marketing,5,18345-23521,Online,2025-03-22,Marketing,"This internship requires skills in Project Management, Accounting, NLP, HTML and relevant experience.",Networking,4
517,Internship 517,Company 517,Kolkata,B.Com,"Deep Learning, Accounting",Research,6,16692-20727,Online,2025-03-27,Healthcare,"This internship requires skills in ML, Communication, NLP, Finance and relevant experience.",Networking,6
518,Internship 518,Company 518,Delhi,MBA,"HTML, Deep Learning",Research,4,15680-24727,Online,2025-04-19,Tech,"This internship requires skills in Marketing, C++ and relevant experience.",Certificate,7
519,Internship 519,Company 519,Hyderabad,M.Com,"Communication, SEO, Excel, JavaScript",E-commerce,4,16027-48876,Hybrid,2025-06-05,Education,"This internship requires skills in Java, C++, SEO, AI and relevant experience.",Networking,9
520,Internship 520,Company 520,Hyderabad,MBA,"Accounting, Java",AI,3,12756-45064,Hybrid,2025-11-27,Education,"This internship requires skills in Communication, Accounting, CSS, Excel, Marketing and relevant experience.",Networking,5
521,Internship 521,Company 521,Hyderabad,M.Com,"Project Management, Excel, AI, UI/UX, SQL",Healthcare,3,17169-45012,Offline,2025-12-13,Finance,"This internship requires skills in Marketing, Data Analysis, Communication and relevant experience.",Flexible Hours,4
522,Internship 522,Company 522,Chennai,B.Tech,"Communication, C++, CSS",E-commerce,1,10636-43785,Hybrid,2025-11-17,Finance,"This internship requires skills in C++, NLP, Deep Learning, Communication and relevant experience.",Stipend,6
523,Internship 523,Company 523,Pune,M.Tech,"NLP, SEO",Marketing,4,17037-43862,Offline,2025-11-18,Marketing,"This internship requires skills in SQL, NLP, Deep Learning and relevant experience.",Certificate,3
524,Internship 524,Company 524,Bangalore,B.Tech,"Deep Learning, JavaScript, C++, Accounting, Project Management",Research,5,12372-46064,Hybrid,2025-01-28,Education,"This internship requires skills in Excel, NLP, Data Analysis and relevant experience.",Flexible Hours,2
525,Internship 525,Company 525,Bangalore,PhD,"Accounting, Project Management, Deep Learning, Python",E-commerce,5,17590-34913,Online,2025-12-19,Tech,"This internship requires skills in Deep Learning, C++ and relevant experience.",Certificate,7
526,Internship 526,Company 526,Pune,BBA,"HTML, C++, CSS, Data Analysis",Technology,2,14289-36524,Online,2025-01-05,Tech,"This internship requires skills in SQL, HTML, Accounting, SEO, ML and relevant experience.",Certificate,8
527,Internship 527,Company 527,Hyderabad,PhD,"Excel, CSS, UI/UX, SQL, Project Management",Research,5,19903-28471,Online,2025-05-07,Tech,"This internship requires skills in Marketing, SEO, Project Management, NLP and relevant experience.",Stipend,3
528,Internship 528,Company 528,Delhi,BBA,"AI, HTML",Design,5,15672-31723,Hybrid,2025-01-11,Education,"This internship requires skills in Excel, Data Analysis, JavaScript, SEO and relevant experience.",Stipend,2
529,Internship 529,Company 529,Mumbai,PhD,"Deep Learning, AI, Data Analysis",Education,1,13952-32183,Online,2025-10-05,Marketing,"This internship requires skills in HTML, CSS, NLP, Accounting, Project Management and relevant experience.",Flexible Hours,7
530,Internship 530,Company 530,Kolkata,BBA,"Data Analysis, SQL, SEO, Deep Learning, Java",E-commerce,6,7189-31522,Online,2025-12-17,Education,"This internship requires skills in Communication, SEO, SQL and relevant experience.",Networking,2
531,Internship 531,Company 531,Pune,PhD,"JavaScript, Python, Accounting, C++",Marketing,3,17369-47847,Online,2025-05-05,AI,"This internship requires skills in Python, HTML, Project Management and relevant experience.",Flexible Hours,3
532,Internship 532,Company 532,Hyderabad,M.Com,"Project Management, Data Analysis, HTML, AI, NLP",AI,1,7057-41563,Online,2025-08-09,Tech,"This internship requires skills in Finance, NLP, SQL, Marketing, Project Management and relevant experience.",Certificate,8
533,Internship 533,Company 533,Hyderabad,B.Tech,"ML, Project Management, HTML, JavaScript",AI,4,8682-36856,Hybrid,2025-04-15,Healthcare,"This internship requires skills in JavaScript, Excel, SQL and relevant experience.",Letter of Recommendation,1
534,Internship 534,Company 534,Kolkata,M.Tech,"CSS, SQL, Finance",Design,1,11412-26913,Hybrid,2025-05-09,Marketing,"This internship requires skills in Deep Learning, SQL, Java and relevant experience.",Networking,6
535,Internship 535,Company 535,Delhi,BBA,"ML, Deep Learning, Marketing, SEO, UI/UX",Education,6,12379-38897,Offline,2025-10-19,Finance,"This internship requires skills in Communication, Java, Deep Learning, UI/UX and relevant experience.",Certificate,5
536,Internship 536,Company 536,Hyderabad,M.Com,"Java, NLP, UI/UX, Accounting, Marketing",AI,4,17376-29227,Online,2025-10-12,Tech,"This internship requires skills in NLP, Excel, Communication, ML, Java and relevant experience.",Flexible Hours,3
537,Internship 537,Company 537,Chennai,BBA,"Project Management, Communication, HTML, JavaScript, CSS",AI,2,19377-35258,Online,2025-02-07,Education,"This internship requires skills in C++, Project Management, CSS, Communication and relevant experience.",Flexible Hours,5
538,Internship 538,Company 538,Chennai,M.Com,"SEO, Python",Operations,5,11487-25649,Hybrid,2025-05-03,Tech,"This internship requires skills in Java, UI/UX, Excel, Deep Learning and relevant experience.",Certificate,3
539,Internship 539,Company 539,Kolkata,B.Tech,"HTML, NLP, UI/UX, CSS, Communication",Healthcare,6,14794-24608,Hybrid,2025-02-22,Healthcare,"This internship requires skills in Data Analysis, Java and relevant experience.",Letter of Recommendation,8
540,Internship 540,Company 540,Bangalore,BBA,"Python, ML",Operations,3,11560-20791,Offline,2025-10-22,Education,"This internship requires skills in Accounting, ML, CSS, Communication, JavaScript and relevant experience.",Certificate,2
541,Internship 541,Company 541,Kolkata,BBA,"Accounting, HTML, Deep Learning, Java, NLP",Finance,3,9980-43874,Offline,2025-01-09,Healthcare,"This internship requires skills in SEO, Communication and relevant experience.",Flexible Hours,4
542,Internship 542,Company 542,Delhi,B.Tech,"Marketing, SEO",AI,4,14130-44472,Offline,2025-07-14,Finance,"This internship requires skills in CSS, HTML, Finance, Communication, Project Management and relevant experience.",Flexible Hours,3
543,Internship 543,Company 543,Hyderabad,PhD,"UI/UX, AI, Java",Healthcare,5,17273-28323,Online,2025-04-16,Tech,"This internship requires skills in Java, Python and relevant experience.",Stipend,3
544,Internship 544,Company 544,Mumbai,B.Com,"Marketing, HTML, JavaScript, Deep Learning",AI,1,7534-48271,Offline,2025-07-05,Finance,"This internship requires skills in Communication, Marketing, JavaScript, Finance, Deep Learning and relevant experience.",Letter of Recommendation,7
545,Internship 545,Company 545,Pune,M.Com,"CSS, Project Management, Accounting",Marketing,2,8978-22456,Hybrid,2025-06-16,Healthcare,"This internship requires skills in ML, Accounting, Python, JavaScript and relevant experience.",Networking,1
546,Internship 546,Company 546,Hyderabad,BBA,"Marketing, Python",Healthcare,4,11849-33098,Hybrid,2025-07-01,Finance,"This internship requires skills in Excel, Accounting, SQL, SEO and relevant experience.",Certificate,2
547,Internship 547,Company 547,Chennai,BBA,"UI/UX, SQL",Education,6,6429-38722,Offline,2025-06-28,Marketing,"This internship requires skills in AI, Deep Learning, NLP, ML and relevant experience.",Stipend,1
548,Internship 548,Company 548,Delhi,B.Tech,"Project Management, Finance, SEO",AI,2,9890-24205,Hybrid,2025-07-03,AI,"This internship requires skills in Excel, AI and relevant experience.",Networking,1
549,Internship 549,Company 549,Chennai,B.Tech,"Excel, SQL",E-commerce,3,11885-39226,Offline,2025-03-16,AI,"This internship requires skills in NLP, C++, JavaScript, UI/UX and relevant experience.",Letter of Recommendation,7
550,Internship 550,Company 550,Mumbai,MBA,"Java, Deep Learning, CSS, JavaScript, AI",Operations,3,9424-38174,Hybrid,2025-08-21,Education,"This internship requires skills in Accounting, Java and relevant experience.",Stipend,1
551,Internship 551,Company 551,Chennai,B.Com,"AI, SEO, C++, JavaScript",E-commerce,1,15855-28553,Offline,2025-07-04,Finance,"This internship requires skills in Accounting, SQL and relevant experience.",Certificate,4
552,Internship 552,Company 552,Chennai,M.Com,"ML, UI/UX, C++",Education,2,13914-38773,Online,2025-07-09,Tech,"This internship requires skills in AI, UI/UX, HTML, NLP and relevant experience.",Letter of Recommendation,5
553,Internship 553,Company 553,Mumbai,PhD,"Accounting, NLP",Design,3,7744-29608,Offline,2025-07-16,Tech,"This internship requires skills in AI, Finance, SEO and relevant experience.",Letter of Recommendation,5
554,Internship 554,Company 554,Kolkata,M.Tech,"Accounting, Marketing",Design,6,9035-41563,Hybrid,2025-10-23,Education,"This internship requires skills in Excel, Accounting, C++, UI/UX and relevant experience.",Certificate,8
